ID,description,img
1,Inpeccionar detalladamente el estado de la carroceria,/loosebagnationalcargo/webapp/media/01.png
2,La corroceria debe estar protegida por carton,/loosebagnationalcargo/webapp/media/02.png
3,Plastico negro extendido a largo de la mula,/loosebagnationalcargo/webapp/media/03.png
4,Siempre utilizar guantes de vaqueta al hacer amarres,/loosebagnationalcargo/webapp/media/04.png
5,Platico verde a lo largo de la mula,/loosebagnationalcargo/webapp/media/05.png
6,Cada participante del cargue es responsable directo de su operacion,/loosebagnationalcargo/webapp/media/06.png

